id,log_price,property_type,room_type,amenities,accommodates,bathrooms,bed_type,cancellation_policy,cleaning_fee,city,description,first_review,host_has_profile_pic,host_identity_verified,host_response_rate,host_since,instant_bookable,last_review,latitude,longitude,name,neighbourhood,number_of_reviews,review_scores_rating,thumbnail_url,zipcode,bedrooms,beds
14253838,4.382026634673881,Loft,Private room,"{Internet,""Wireless Internet"",Kitchen,Elevator,""Buzzer/wireless intercom"",Heating,Washer,Dryer,""Smoke detector"",""Carbon monoxide detector"",""First aid kit"",Essentials,Shampoo}",2,1,Real Bed,moderate,FALSE,NYC,"1 bedroom available in a large, open loft with high ceilings located in WILLIAMSBURG off the bedford ave stop on the L train, 2 blocks from the river very safe neighborhood surrounded by bars, restaurants, WIFI plus all amenities included Private room in a 2br loft apartment in the heart of Williamsburg Located right between the Bedford ave. stop off the L train (1 stop away from Manhattan and only 3 stops away from Union Square L,N,Q,R,4,5,6 ) and the Marcy stop off the J and M as well as the Lorimer G train located a few blocks north of the williamsburg bridge and 2 blocks from the river. Wi Fi Internet Access and utilities included. Fresh linens (bed and bath towels provided) photos of bedroom coming soon!! (includes a lofted double bed with storage and closet for clothes as well as reading lamp, chair, desk Private room, common area with: kitchen/livingroom, office, bathroom, laundry on the same floor with washer/dryer I'll be present at the listing during my guest's stay but work ",,t,t,,3/26/15,f,,40.71374668,-73.96311552,"1 bedroom, large williamsburg loft",Williamsburg,0,,https://a0.muscache.com/im/pictures/72378249/c929bd3b_original.jpg?aki_policy=small,11249,1,1
20738762,5.247024072160486,Apartment,Entire home/apt,"{TV,""Cable TV"",Internet,""Wireless Internet"",""Air conditioning"",Kitchen,Doorman,Elevator,Heating,""Family/kid friendly"",Washer,Dryer,Essentials,Shampoo}",6,1,Real Bed,flexible,TRUE,NYC,"Hi! I am currently listing my large, spacious 2 bedroom apartment in West Harlem near Columbia University. The 1 subway train is 2 blocks away. Doorman building. Delis, Duane Reade, Restaurants all nearby.",,t,f,,7/21/15,f,,40.81910973716828,-73.95670408,"Large, Spacious 2 BR in Manhattan",Harlem,0,,https://a0.muscache.com/im/pictures/97755452/b22c2ac2_original.jpg?aki_policy=small,10031,2,2
16221430,5.857933154483459,Apartment,Entire home/apt,"{TV,""Wireless Internet"",""Air conditioning"",Kitchen,""Indoor fireplace"",Heating,""Smoke detector"",Essentials,Shampoo,""Lock on bedroom door"",Hangers,Iron,""Laptop friendly workspace""}",3,1,Real Bed,flexible,TRUE,NYC,"Designer Mid-Century 1 Bedroom jewel with roofdeck in the heart of the West Village. Enjoy 7 windows and an entire floor to yourself in this romantic getaway, perfectly located in the midst of prime downtown Manhattan. Steps to Washington Square Park, three blocks to the West River, one block from ten major subway lines, and less than 5 minutes away from Meatpacking, SoHo, Nolita, and more than 70 top restaurants and bars. This luxurious spot is perfect for those working or playing in NY. A top floor, 3rd story walkup, exceptionally open and airy, floor-through apartment located in a small, charming building in the historic West Village/Greenwich Village district, this characterful 1 bedroom features a comfortable queen bed with Italian linens, and a collection of vintage mid century modern teak and walnut furnishings. Two air conditioners and baseboard heaters, seven windows full of light, a small fully-featured kitchen with glass cooktop and dishwasher, spacious dining table for four",8/27/17,t,t,100%,8/9/12,f,9/24/17,40.73321322998492,-74.00242068,"Luxurious, bright West Village 1BR with Roofdeck",West Village,3,100,https://a0.muscache.com/im/pictures/4258aff8-9445-4bbd-bdd5-b83ea0b24750.jpg?aki_policy=small,10014,1,1
13398011,4.574710978503383,Loft,Entire home/apt,"{TV,Internet,""Wireless Internet"",Kitchen,Heating,""Family/kid friendly"",Washer,Dryer,""Smoke detector"",""Carbon monoxide detector"",""First aid kit"",""Safety card"",""Fire extinguisher"",Essentials,Shampoo}",6,1,Real Bed,strict,TRUE,NYC,"Gorgeous 1000 sq ft loft with 12' ceilings, sunset Manhattan views, antique Balinese furniture, full kitchen, only 20 minutes to Union Square with the Jefferson L train- with amazing new bars, restaurants, and street art on the way home! The light coming through in the afternoon and at sunset is truly magical- full downtown view, up to the Empire State building! There's also a pommel horse in case you're an aspiring gymnast :) Full kitchen, super comfy couch, TV, fast internet, nice and hot shower, and there's a washer/dryer down the hall. Can sleep 2 in the bedroom, another 2 on an air mattress, and another 2 on the couch. If you'd just be interested in the room and not the whole place, check out my other listing: https://www.airbnb.com/rooms/5326138 The whole place! I keep the smaller lofted bedroom closed- it could potentially be made available though. Again, if you're just interested in the room my other listing is here: https://www.airbnb.com/rooms/5326138 I'm rarely at home in th",2/15/15,t,t,89%,3/8/12,t,6/11/17,40.70827289776521,-73.92263996,Eclectic Loft 20 min-> Union Sq! ,Bushwick,22,96,https://a0.muscache.com/im/pictures/0312e279-cff1-49ac-9950-067f57a1077a.jpg?aki_policy=small,11237,1,6
18472310,4.0943445622220995,Apartment,Private room,"{TV,Internet,""Wireless Internet"",""Air conditioning"",Kitchen,Doorman,Gym,Elevator,""Buzzer/wireless intercom"",Heating,Washer,Dryer,""Smoke detector"",""Carbon monoxide detector"",Essentials,""Lock on bedroom door"",Hangers,""Laptop friendly workspace"",""translation missing: en.hosting_amenity_49"",""translation missing: en.hosting_amenity_50""}",2,1,Real Bed,moderate,TRUE,NYC,"Welcome! This private room with shared bath in the hot Long Island City neighborhood is only 5-10 min from manhattan with 6 different subways lines (E,M,R,N,Q,7) less than 2 blocks away, putting the whole city at your fingertips! Check out our game room and gym in your free time. Room has heater, dresser, Queen bed. Full kitchen, wifi, cable, netflix, xbox, wii with comfy couches in common room. Hang with us, watch movies, make group dinners.  We love having guests! Questions? Ask away! Great location less than 10 min from Manhattan with access to 6 subways!  Friendly atmosphere: hang out and watch some Netflix, play some video games, or grab a beer with us.  Like to cook?  So do we!  Don't forget the gym and game room! TV, video games, wifi, kitchen, private bathroom, and all building amenities. My roommate and I are both young professionals working in NY.  We love meeting and getting to know new people.  You're encouraged to hang out and watch a movie or chat with us over dinner! Lon",5/19/16,t,t,,8/21/14,f,7/26/16,40.75120430009384,-73.94019457,Private room 5 min from manhattan!,Astoria,3,80,https://a0.muscache.com/im/pictures/bc214004-66fe-4154-9c8b-2d12806019a8.jpg?aki_policy=small,11101,1,1
18524434,5.010635294096256,Apartment,Private room,"{TV,""Wireless Internet"",Kitchen,Heating,Washer,Dryer,""Smoke detector"",""First aid kit"",""Safety card"",Essentials,Shampoo,""Lock on bedroom door"",Hangers,Iron,""Laptop friendly workspace"",""Private living room""}",1,1,Real Bed,flexible,FALSE,SF,Light filled front room with twin bed in Mission flat.,9/1/17,t,f,100%,7/31/12,f,9/1/17,37.743459623135436,-122.4235098,solo Mission get away,Noe Valley,1,100,https://a0.muscache.com/im/pictures/06d45e80-b4b2-4e02-9172-77b34ff76c58.jpg?aki_policy=small,94110,1,1
19225024,4.859812404361672,House,Private room,"{TV,""Cable TV"",Internet,""Wireless Internet"",Kitchen,""Free parking on premises"",Heating,""Family/kid friendly"",Washer,Dryer,""Smoke detector"",""Carbon monoxide detector"",""First aid kit"",""Fire extinguisher"",Essentials,Shampoo,""Lock on bedroom door"",""24-hour check-in"",Hangers,""Hair dryer"",Iron,""Laptop friendly workspace"",""Self Check-In"",Lockbox,Bathtub,""Children’s books and toys"",""Children’s dinnerware"",Microwave,""Coffee maker"",Refrigerator,Dishwasher,""Dishes and silverware"",""Cooking basics"",Oven,Stove,""BBQ grill"",""Patio or balcony"",""Garden or backyard"",""Luggage dropoff allowed"",""Step-free access"",""Flat, smooth pathway to front door"",""Well-lit path to entrance""}",4,1,Real Bed,strict,TRUE,SF,"You’ll love my San Francisco home because of the  free parking, amazing views, vibrant colorful multi-ethnic location, and very safe family friendly neighborhood . You are only 9 miles from the airport (about a 10 minute drive). My place is perfect for couples, solo adventurers, business travelers, and families (with kids). This is a garden view room on the ground floor with a queen size bed and a pull out full size bed/sofa. It has it's own private connected bathroom with tub/shower. Large Screen TV with lots of Apple movies and full cable including Netflix, HBO, Showtime, and Hulu. Upstairs their is a shared fun gourmet kitchen with free coffee. you will find a comfortable living room and dinning area to relax in. Guest are provided a lockbox with house key to come and go at their own lesure. I am a third generation native San Franciscan, single father, ( my children are grown and living away from home). I love sharing my favorite places to go in the city. I am also a professional ph",10/10/16,t,t,100%,11/12/13,t,9/25/17,37.7219829,-122.4075767,Private room with attached private bathroom,Portola,31,93,https://a0.muscache.com/im/pictures/4b7d021f-a10a-49ed-ab2c-663f2e7cf7ef.jpg?aki_policy=small,94134,1,2
18840866,5.087596335232384,Apartment,Entire home/apt,"{TV,""Cable TV"",Internet,""Wireless Internet"",""Air conditioning"",Kitchen,""Free parking on premises"",""Buzzer/wireless intercom"",Heating,""Family/kid friendly"",Washer,Dryer,""Smoke detector"",""Carbon monoxide detector"",Essentials,Shampoo,""Lock on bedroom door"",""24-hour check-in"",Hangers,Iron,""Laptop friendly workspace"",""Self Check-In"",Lockbox,""Private entrance""}",7,2,Real Bed,strict,TRUE,LA,"This lovely apartment With over 1400 square feet of living space, it has two bedroom/ two bath, a full kitchen with. Appliance, flat screen TV, hardwood Floors, two private parking and Everything   You’ll need for A carefree vacation!  Stay touch with loved ones back Home as wireless internet and cable are included your Rental package tastefully refreshed for The Modern traveler on vacation or business. a variety of Retail stores, specialty shop and Restaurant are Accessible within minutes. The fully appointed kitchen will eliminate the Need to go out dining. For every meal, the availability of local produce and fruit, that California is famous for will enable you to sit back and relax to watch your large flat screen TV after a long day of taking in the Site and atmospheric! Comfortable couch, TV with cable, coffee table.  The kitchen is stocked with all major appliances such as: gas stove& oven, refrigerator, microwave, toaster, & coffee maker. Inside the Kitchen cabinets we’ve provid",12/27/16,t,t,100%,6/29/16,t,2/11/17,34.18104334180944,-118.3045588,Huge 2BD/2 BATH. Apt. fully furnished in Burbank,Burbank,6,84,https://a0.muscache.com/im/pictures/f0e73458-64a1-4ebb-803c-eed5c6a8ba64.jpg?aki_policy=small,91501,2,3
2586472,5.010635294096256,Apartment,Entire home/apt,"{Internet,""Wireless Internet"",""Air conditioning"",Kitchen,""Free parking on premises"",Gym,Elevator,""Buzzer/wireless intercom"",Heating,Washer,Dryer,""Smoke detector"",""Carbon monoxide detector"",""Hair dryer""}",2,1,Real Bed,flexible,FALSE,NYC,"I am an entrepreneur in the health and wellness space looking to rent out my apartment of couch (really a woven cot). Happy to make you a power smoothie in the morning. The apt is a few blocks from the park, the subway and all the shopping and food establishments that populate the upper east side. Modern, new boutique building with elevator. Spacious one bedroom with floor to ceiling windows. Large, mostly quiet.",,t,t,,5/18/12,f,,40.78789197912051,-73.95056974,UES Modern boutique building,East Harlem,0,,https://a0.muscache.com/im/pictures/a7b123b1-ff81-4818-b5b5-1b7ff2b6f52d.jpg?aki_policy=small,10029,1,1
20761244,3.871201010907892,Condominium,Private room,"{TV,Internet,""Wireless Internet"",Pool,Kitchen,""Pets allowed"",Gym,""Elevator in building"",""Hot tub"",Washer,Dryer,""Smoke detector"",""Carbon monoxide detector"",""Fire extinguisher"",Essentials,Shampoo,""24-hour check-in"",""translation missing: en.hosting_amenity_49"",""translation missing: en.hosting_amenity_50""}",4,1,Real Bed,flexible,TRUE,LA,"Only 3 miles from  LAX. In between Westfield Culver City shopping mall and the Promenade Howard Hughes Center where there is a movie theater and many restaurants. Close to Playa Vista, Corporate Pointe. 4-5 miles  from Marina Del Rey,  Santa Monica , and Venice Beach. 2bed/2bath condo. The Master bedroom with very own bathroom , two queen beds , big closets , nice sized mirrors. Cable Tv with DVR . Clean laminated floors and blackout curtains . Wifi of course !! The kitchen  , hot pot and French press for coffee. 5 community laundry rooms. 3 swimming pools to enjoy in the California sunshine , two jacuzzi's   for relaxation . Gym with safe equipment and a sauna room ! If you have any questions about Los Angeles or need directions somewhere I'd be more than happy to help! Safe Gated community in Heather Village Condominiums. There is fox hills park down the street with a nice jogging track. Neighborhood is full of pine trees, gas station convenience store down the street. Wells Fargo an",2/25/17,t,t,100%,1/5/17,t,4/2/17,33.98029790327221,-118.3865229,COZY High Ceiling MasterBedroom !,,10,92,https://a0.muscache.com/im/pictures/b655e8bf-4a1a-49ea-8701-ff73073ed528.jpg?aki_policy=small,90230,1,2
3976798,5.5606816310155285,House,Entire home/apt,"{TV,""Cable TV"",Internet,""Wireless Internet"",""Air conditioning"",Kitchen,""Free parking on premises"",""Hot tub"",Heating,Washer,Dryer,""Smoke detector"",""Carbon monoxide detector"",Essentials,Shampoo,""24-hour check-in"",Hangers,""Hair dryer""}",4,2.5,Real Bed,strict,TRUE,LA,"Our brand-new 2-bdrm is comfortably appointed and in a great location. 1600 sf, 20-foot operable glass wall, LEED Gold. Steps from Moby's new restaurant, gourmet coffee, and yoga. Balcony hot tub with views of Griffith Park Observatory. Parking spot! Detached basement unit with separate entrance is occupied.",1/5/16,t,t,,11/5/13,f,1/5/16,34.10762628,-118.267016,Stunning Silverlake Modern Home,Silver Lake,1,100,https://a0.muscache.com/im/pictures/1b051905-7470-4a01-9de2-5a0c4b70ea8c.jpg?aki_policy=small,90039,2,2
17812291,3.80666249,Apartment,Private room,"{""Wireless Internet"",""Smoke detector"",""Fire extinguisher"",Essentials,""Lock on bedroom door"",""Laptop friendly workspace"",""translation missing: en.hosting_amenity_49"",""translation missing: en.hosting_amenity_50""}",1,1,Futon,strict,TRUE,NYC,"Stay in this large room with hammock. Citi bike share right outside and one block from Von King Park. Within walking distance to various local hip bars and restaurants. This room belongs to Teddy, who is currently cat sitting in another apartment for the summer, but will be nearby to help get your settled and oriented. The room is large and has plenty of light. A ceiling fan to keep you cool at night, and a hammock to relax in. There is a bathroom that is shared with the other person in the apartment, and a little kitchen available. A very uniquely Bed-stuy art scene.",9/18/16,t,t,90%,10/12/15,f,8/14/17,40.690330687790066,-73.94216841,Artist's room in the heart of chic Bed-Sty,Bedford-Stuyvesant,4,95,https://a0.muscache.com/im/pictures/6a25549d-ffea-4fec-88d9-60d554c62bcb.jpg?aki_policy=small,11221,1,1
1168086,4.0943445622220995,House,Private room,"{""Wireless Internet"",""Air conditioning"",Kitchen,""Free parking on premises"",Heating,""Family/kid friendly"",""Smoke detector"",""Carbon monoxide detector"",""First aid kit"",""Fire extinguisher"",Essentials,Shampoo,Hangers,""Hair dryer"",Iron,""Laptop friendly workspace""}",3,1,Real Bed,strict,TRUE,DC,"My place is close to restaurants and dining, family-friendly activities, nightlife, and public transport.  If you love being close to the action and enjoy a peaceful night, this is the perfect place for you. You're a short ride from Capitol Hill and H Streets Restaurants and Bars. The metro is walking distance and requires no transfer to DCA airport. My place is good for couples, solo adventurers, business travelers, and families (with kids). Blue line metro - 5 to 10 minute walk Union Station/Metro- 15 minute ride  Bus Stops 5 minute walk Typical uber and lyft wait 2-5 minutes. Street parking available.",4/4/17,t,f,100%,7/28/15,f,4/4/17,38.89403438667299,-76.93555537,City Life with a Suburban Feel,Hillbrook,1,80,https://a0.muscache.com/im/pictures/43b06a33-6e7e-4b7e-bccb-29fd2b1c5e4d.jpg?aki_policy=small,20019,1,1
19692298,4.700480365792417,House,Entire home/apt,"{TV,Internet,""Wireless Internet"",""Air conditioning"",Kitchen,Heating,""Smoke detector"",Hangers,""Hair dryer"",Iron,""translation missing: en.hosting_amenity_49"",""translation missing: en.hosting_amenity_50""}",3,1,Real Bed,flexible,TRUE,Chicago,"Charming cozy one bedroom w a king size temperpedic bed. Available for full month sublet!! Half a block from the California blue line (24 hr train) 20min to O'hare, 10 to the loop. Best place to stay in Logan Square. Safe, hip & conveniently located. The house is also available for full months!! My house is the best most beautiful cozy conveniently located place. 1/2 a block from the 24 hr EL train (subway). Steps away from dozens and dozens of bars & restaurants yet on a very safe quiet family oriented street. Truly perfect location!! I'm also flexible & will work w you on check-in/check-out times. Bottom floor of a duplex w chill, friendly, quiet upstairs neighbor. HUGE flatscreen w Apple TV, wifi, bathtub & shower, most comfortable bed I've ever slept in, 6 drawer dresser, lots of heat, cool window ledge u can sit on and read or just relax, plenty of kitchen supplies (small kitchen) but I make it work :-) Full month sublet available all year. Plz contact me for further info!!",11/23/15,t,f,100%,3/15/15,f,11/21/16,41.921360308987616,-87.69941591,Charming bohemian duplex w King bed,,18,97,https://a0.muscache.com/im/pictures/a8312755-d214-4b56-8a2f-6f6acfec8900.jpg?aki_policy=small,60647,1,1
262343,4.700480365792417,Apartment,Entire home/apt,"{TV,Kitchen,Heating,""Smoke detector"",Essentials,""Lock on bedroom door"",""Laptop friendly workspace"",""translation missing: en.hosting_amenity_49"",""translation missing: en.hosting_amenity_50""}",5,2,Real Bed,flexible,TRUE,NYC,"Sunny, large, 2 bedroom/2 bath with sleeper couch in quiet clean apartment only 10 min. walk from Prospect Park, Brooklyn Museum and lots of cute places to eat. Only 3 blocks form 3 & 4 Trains, Q & B trains are 10 min away. Private bath, private entrance in front of apartment, Living Rm, Dining Rm and Kitchen. My place is close to Salems Hour, Pels Pie, Prospect Park, Midwood Flats,  and a Lil Mo Wine. My place is good for couples, solo adventurers, business travelers, and groups of 5. Although the apartment is shared I have my own separate suite with its own bathroom and private entrance removed from the common area. It's perfect for a quiet get away or an escape to get some work done. There is a large living/dining space including TV with Chromecast & HiFi speakers and full sized kitchen. The bedrooms are at opposite ends of this very spacious 2.5 bedroom, 2 bath so occupants in each bedroom won't hear each other. The couch in the living room sleeps 1. The front rooms catch morning l",,,,,,t,,40.661488837938215,-73.95182313,Brooklyn 2 Bdrm Apt. w/ 2 baths,Lefferts Garden,0,,https://a0.muscache.com/im/pictures/a1755c3c-c9ec-44a2-ae60-bee9602e6b2b.jpg?aki_policy=small,11225,2,2
15734037,5.1929568508902095,Apartment,Entire home/apt,"{TV,Internet,""Wireless Internet"",""Air conditioning"",Kitchen,""Buzzer/wireless intercom"",Heating,""Family/kid friendly"",""Smoke detector"",""Fire extinguisher"",Essentials}",5,1,Real Bed,flexible,TRUE,NYC,"650 sq. ft., kitchen, livingroom w/ dining area, full bathroom, and large bedroom. Third floor of a walk-up building. Although it's an older building, everything works very well. Original decorative molding on walls. Lots of light throughout!  Windows in every room.  Apt gets lots of sun! Kitchen has everything you'd need.  Cookware, plates/bowls/cutlery/appliances. There is a fire escape in the kitchen. Livingroom is large and has tv with roku box and local channels. Full size bed and desk in bedroom. Couch sleeps one.  Air mattress could accommodate two more.   One of the safest blocks in NYC.  Security camera outside.  Working buzzer system. Great area--very safe, lots to do! Surrounded by TONS of restaurants, bars, cafes, cute shops, etc. While there are lots of places close by, the block (and a couple of the surrounding blocks) feel relatively quiet and residential for NYC.  Lots of families.  There is a public library across the street and two cafes on the block (one Italian, one",,t,f,,1/22/15,f,,40.71270422233128,-73.94643149,"Large, comfy 1br in Williamsburg!",Williamsburg,0,,,11211,1,2
5011392,4.248495242049359,Apartment,Entire home/apt,"{""Wireless Internet"",""Air conditioning"",Kitchen,Heating,Washer,Dryer,""Smoke detector"",""Carbon monoxide detector"",""Fire extinguisher"",Essentials,Hangers,Iron,""translation missing: en.hosting_amenity_49"",""translation missing: en.hosting_amenity_50"",""Private entrance""}",2,1,Real Bed,flexible,TRUE,DC,Studio with private bathroom and walk in closet.  15 minute walk to Chinatown and downtown restaurants. Giant supermarket 2 blocks away.   2 blocks to metro.  Great access to 7th and 9th street restaurants and cafes. Great new restaurants and cafes in the area.  Try Sundevich for one of the best sandwich places in town..get there early before they run out of ingredients for the day. Bus lines on 9th and 7th street.  Shaw metro 2 blocks north and Convention Center metro 3.5 blocks south.  DC Bike share 1.5 blocks away.,,t,t,,4/12/12,t,,38.91140319966409,-77.02163619,Charming studio in hip Shaw/Logan neighborhood,Shaw,0,,https://a0.muscache.com/im/pictures/0aec0e43-6c3c-4faa-984e-d032e1b25c99.jpg?aki_policy=small,20001,1,1
1830541,5.393627546352364,Condominium,Entire home/apt,"{TV,""Cable TV"",Internet,""Wireless Internet"",""Air conditioning"",Kitchen,""Free parking on premises"",Heating,""Smoke detector"",""Fire extinguisher"",Essentials,""Lock on bedroom door"",Hangers,""Hair dryer"",Iron,""Laptop friendly workspace"",""translation missing: en.hosting_amenity_49"",""translation missing: en.hosting_amenity_50"",""Private entrance""}",3,1,Real Bed,flexible,TRUE,DC,"Beautiful Condo close to Capitol Building, White House, National Mall, Eastern Market, Museums, Restaurants and Dining. Modern Courtyard Style Condo with a large bedroom, full bath, Hardwood floors, centralized air and heat. The space comes with additional amenities including Cable and Wifi. Credentials will be available upon arrival. Condo is fully secure with touch pad entry (No Key required). Code will be given to guests upon arrival. The condo is located near the Potomac Avenue and Naylor Rd Metro Stations. Within 10 minutes or less, you can enjoy many popular locations including Eastern Market, Smithsonian Museums, Capitol Building, Dupont Circle, U ST and H ST.",,t,f,,1/3/17,f,,38.86353354138231,-76.9492231,Modern Condo in the heart of Capitol Hill,Hillcrest,0,,https://a0.muscache.com/im/pictures/59cb2321-0bd0-4809-b920-694db5a109a6.jpg?aki_policy=small,20020,1,1
4576821,4.248495242049359,Apartment,Entire home/apt,"{""Wireless Internet"",Kitchen,Breakfast,Elevator,Washer,Dryer,""Smoke detector"",""Carbon monoxide detector"",Essentials,Hangers,""Hair dryer"",Iron,""Laptop friendly workspace"",""translation missing: en.hosting_amenity_49"",""translation missing: en.hosting_amenity_50""}",1,1,Real Bed,flexible,TRUE,NYC,"Single person studio available in the heart of Park Slope! Just one block from Prospect Park. Close to wonderful restaurants and bars. The apartment is about a five minute walk to the F G trains; about a 10 minute walk to the B Q 2 3. The building is very quiet and mostly occupied by young professionals. I am looking for a guest who will respect the place, keep it tidy and can be a quiet neighbor. Perfect getaway for someone who's looking for a quaint spot in a beautiful park of Brooklyn.",7/4/16,t,t,100%,11/25/14,f,9/29/17,40.669025811351865,-73.97707905,Charming Studio in Park Slope,Park Slope,2,100,https://a0.muscache.com/im/pictures/6666b75f-4bc7-447c-adda-f6ec01a4166f.jpg?aki_policy=small,,0,1
